{
  "$id": "https://nearmiss.dev/schema/public-fars-state-context.schema.json",
  "$schema": "https://json-schema.org/draft/2020-12/schema",
  "additionalProperties": false,
  "properties": {
    "accounting": {
      "additionalProperties": false,
      "properties": {
        "case_count": {
          "maximum": 45000,
          "minimum": 30000,
          "type": "integer"
        },
        "crash_contribution_total": {
          "maximum": 270000,
          "minimum": 30000,
          "type": "integer"
        },
        "positive_candidate_cell_count": {
          "maximum": 306,
          "minimum": 0,
          "type": "integer"
        },
        "positive_suppressed_cell_count": {
          "maximum": 306,
          "minimum": 0,
          "type": "integer"
        },
        "published_cell_count": {
          "maximum": 306,
          "minimum": 0,
          "type": "integer"
        },
        "published_crash_contribution_total": {
          "maximum": 270000,
          "minimum": 0,
          "type": "integer"
        },
        "state_count": {
          "const": 51
        },
        "state_mode_cell_count": {
          "const": 306
        },
        "suppressed_crash_contribution_total": {
          "maximum": 270000,
          "minimum": 0,
          "type": "integer"
        },
        "suppressed_or_zero_cell_count": {
          "maximum": 306,
          "minimum": 0,
          "type": "integer"
        }
      },
      "required": [
        "case_count",
        "state_count",
        "state_mode_cell_count",
        "published_cell_count",
        "suppressed_or_zero_cell_count",
        "positive_candidate_cell_count",
        "positive_suppressed_cell_count",
        "crash_contribution_total",
        "published_crash_contribution_total",
        "suppressed_crash_contribution_total"
      ],
      "type": "object"
    },
    "artifact_type": {
      "const": "nearmiss.public.fars_state_context"
    },
    "caveat": {
      "const": "Counts are distinct 2024 FARS fatal crashes with at least one person in the involved mode, counted at most once per crash per mode. They are fatal-crash burden context, not exposure-normalized risk, incidence, causation, nonfatal crashes, near misses, record linkage, outcome validation, or a safety ranking. Mode cells overlap and are non-additive. A suppressed_or_zero cell combines a true zero with a positive count below k=10 and must never be read as zero. k=10 is a stability and publication guard for already-public FARS data, not a confidentiality guarantee. The official 2024 National archive covers the 50 states and District of Columbia; Puerto Rico requires a separately verified source."
    },
    "dataset_year": {
      "const": 2024
    },
    "geography": {
      "additionalProperties": false,
      "properties": {
        "coverage": {
          "const": "official_2024_national_50_states_and_dc"
        },
        "state_count": {
          "const": 51
        },
        "state_crosswalk_sha256": {
          "const": "6744b12717b0bd52a79c73aba3037286dde9257698a2aa0630f995c8a82ba25c"
        },
        "state_crosswalk_version": {
          "const": "fars-usps-50-states-dc-2024-v1"
        },
        "type": {
          "const": "fars_state_code"
        }
      },
      "required": [
        "type",
        "coverage",
        "state_count",
        "state_crosswalk_version",
        "state_crosswalk_sha256"
      ],
      "type": "object"
    },
    "metric": {
      "additionalProperties": false,
      "properties": {
        "algorithm_version": {
          "const": "state-involved-mode-v1"
        },
        "contribution_unit": {
          "const": "distinct_crash_once_per_involved_mode"
        },
        "dimension": {
          "const": "involved_mode"
        },
        "effective_k": {
          "const": 10
        },
        "modes": {
          "items": false,
          "maxItems": 6,
          "minItems": 6,
          "prefixItems": [
            {
              "const": "motor_vehicle_occupant"
            },
            {
              "const": "motorcyclist"
            },
            {
              "const": "pedalcyclist"
            },
            {
              "const": "pedestrian"
            },
            {
              "const": "other_road_user"
            },
            {
              "const": "unknown"
            }
          ],
          "type": "array"
        },
        "modes_non_additive": {
          "const": true
        }
      },
      "required": [
        "algorithm_version",
        "dimension",
        "contribution_unit",
        "effective_k",
        "modes_non_additive",
        "modes"
      ],
      "type": "object"
    },
    "schema_version": {
      "const": "1.0.0"
    },
    "source": {
      "additionalProperties": false,
      "properties": {
        "distribution_url": {
          "const": "https://static.nhtsa.gov/nhtsa/downloads/FARS/2024/National/FARS2024NationalCSV.zip"
        },
        "name": {
          "const": "NHTSA Fatality Analysis Reporting System (FARS)"
        },
        "raw_sha256": {
          "const": "5112727a8c0dc91ffee27ca05bddb073934f2d192ce4fae997da767dccdbe04f"
        },
        "raw_size_bytes": {
          "const": 32672161
        },
        "release_stage": {
          "const": "final"
        },
        "source_revision_id": {
          "const": "reviewed-20260712-5112727a8c0d"
        }
      },
      "required": [
        "name",
        "release_stage",
        "distribution_url",
        "source_revision_id",
        "raw_size_bytes",
        "raw_sha256"
      ],
      "type": "object"
    },
    "states": {
      "items": {
        "additionalProperties": false,
        "properties": {
          "cells": {
            "items": {
              "oneOf": [
                {
                  "additionalProperties": false,
                  "properties": {
                    "crash_count": {
                      "maximum": 45000,
                      "minimum": 10,
                      "type": "integer"
                    },
                    "involved_mode": {
                      "enum": [
                        "motor_vehicle_occupant",
                        "motorcyclist",
                        "pedalcyclist",
                        "pedestrian",
                        "other_road_user",
                        "unknown"
                      ],
                      "type": "string"
                    },
                    "status": {
                      "const": "published"
                    }
                  },
                  "required": [
                    "involved_mode",
                    "status",
                    "crash_count"
                  ],
                  "type": "object"
                },
                {
                  "additionalProperties": false,
                  "properties": {
                    "involved_mode": {
                      "enum": [
                        "motor_vehicle_occupant",
                        "motorcyclist",
                        "pedalcyclist",
                        "pedestrian",
                        "other_road_user",
                        "unknown"
                      ],
                      "type": "string"
                    },
                    "status": {
                      "const": "suppressed_or_zero"
                    }
                  },
                  "required": [
                    "involved_mode",
                    "status"
                  ],
                  "type": "object"
                }
              ]
            },
            "maxItems": 6,
            "minItems": 6,
            "type": "array"
          },
          "state_abbreviation": {
            "enum": [
              "AL",
              "AK",
              "AZ",
              "AR",
              "CA",
              "CO",
              "CT",
              "DE",
              "DC",
              "FL",
              "GA",
              "HI",
              "ID",
              "IL",
              "IN",
              "IA",
              "KS",
              "KY",
              "LA",
              "ME",
              "MD",
              "MA",
              "MI",
              "MN",
              "MS",
              "MO",
              "MT",
              "NE",
              "NV",
              "NH",
              "NJ",
              "NM",
              "NY",
              "NC",
              "ND",
              "OH",
              "OK",
              "OR",
              "PA",
              "RI",
              "SC",
              "SD",
              "TN",
              "TX",
              "UT",
              "VT",
              "VA",
              "WA",
              "WV",
              "WI",
              "WY"
            ],
            "type": "string"
          },
          "state_code": {
            "enum": [
              "1",
              "2",
              "4",
              "5",
              "6",
              "8",
              "9",
              "10",
              "11",
              "12",
              "13",
              "15",
              "16",
              "17",
              "18",
              "19",
              "20",
              "21",
              "22",
              "23",
              "24",
              "25",
              "26",
              "27",
              "28",
              "29",
              "30",
              "31",
              "32",
              "33",
              "34",
              "35",
              "36",
              "37",
              "38",
              "39",
              "40",
              "41",
              "42",
              "44",
              "45",
              "46",
              "47",
              "48",
              "49",
              "50",
              "51",
              "53",
              "54",
              "55",
              "56"
            ],
            "type": "string"
          },
          "state_name": {
            "enum": [
              "Alabama",
              "Alaska",
              "Arizona",
              "Arkansas",
              "California",
              "Colorado",
              "Connecticut",
              "Delaware",
              "District of Columbia",
              "Florida",
              "Georgia",
              "Hawaii",
              "Idaho",
              "Illinois",
              "Indiana",
              "Iowa",
              "Kansas",
              "Kentucky",
              "Louisiana",
              "Maine",
              "Maryland",
              "Massachusetts",
              "Michigan",
              "Minnesota",
              "Mississippi",
              "Missouri",
              "Montana",
              "Nebraska",
              "Nevada",
              "New Hampshire",
              "New Jersey",
              "New Mexico",
              "New York",
              "North Carolina",
              "North Dakota",
              "Ohio",
              "Oklahoma",
              "Oregon",
              "Pennsylvania",
              "Rhode Island",
              "South Carolina",
              "South Dakota",
              "Tennessee",
              "Texas",
              "Utah",
              "Vermont",
              "Virginia",
              "Washington",
              "West Virginia",
              "Wisconsin",
              "Wyoming"
            ],
            "type": "string"
          }
        },
        "required": [
          "state_code",
          "state_abbreviation",
          "state_name",
          "cells"
        ],
        "type": "object"
      },
      "maxItems": 51,
      "minItems": 51,
      "type": "array"
    },
    "title": {
      "const": "2024 US fatal-crash burden by state and involved mode"
    },
    "visibility": {
      "const": "public"
    }
  },
  "required": [
    "schema_version",
    "artifact_type",
    "visibility",
    "title",
    "dataset_year",
    "source",
    "geography",
    "metric",
    "accounting",
    "caveat",
    "states"
  ],
  "title": "Public NearMiss 2024 FARS state burden context",
  "type": "object"
}
