{"accounting":{"case_count":36127,"crash_contribution_total":48524,"positive_candidate_cell_count":292,"positive_suppressed_cell_count":86,"published_cell_count":206,"published_crash_contribution_total":48154,"state_count":51,"state_mode_cell_count":306,"suppressed_crash_contribution_total":370,"suppressed_or_zero_cell_count":100},"artifact_type":"nearmiss.public.fars_state_context","caveat":"Counts are distinct 2024 FARS fatal crashes with at least one person in the involved mode, counted at most once per crash per mode. They are fatal-crash burden context, not exposure-normalized risk, incidence, causation, nonfatal crashes, near misses, record linkage, outcome validation, or a safety ranking. Mode cells overlap and are non-additive. A suppressed_or_zero cell combines a true zero with a positive count below k=10 and must never be read as zero. k=10 is a stability and publication guard for already-public FARS data, not a confidentiality guarantee. The official 2024 National archive covers the 50 states and District of Columbia; Puerto Rico requires a separately verified source.","dataset_year":2024,"geography":{"coverage":"official_2024_national_50_states_and_dc","state_count":51,"state_crosswalk_sha256":"6744b12717b0bd52a79c73aba3037286dde9257698a2aa0630f995c8a82ba25c","state_crosswalk_version":"fars-usps-50-states-dc-2024-v1","type":"fars_state_code"},"metric":{"algorithm_version":"state-involved-mode-v1","contribution_unit":"distinct_crash_once_per_involved_mode","dimension":"involved_mode","effective_k":10,"modes":["motor_vehicle_occupant","motorcyclist","pedalcyclist","pedestrian","other_road_user","unknown"],"modes_non_additive":true},"schema_version":"1.0.0","source":{"distribution_url":"https://static.nhtsa.gov/nhtsa/downloads/FARS/2024/National/FARS2024NationalCSV.zip","name":"NHTSA Fatality Analysis Reporting System (FARS)","raw_sha256":"5112727a8c0dc91ffee27ca05bddb073934f2d192ce4fae997da767dccdbe04f","raw_size_bytes":32672161,"release_stage":"final","source_revision_id":"reviewed-20260712-5112727a8c0d"},"states":[{"cells":[{"crash_count":839,"involved_mode":"motor_vehicle_occupant","status":"published"},{"crash_count":123,"involved_mode":"motorcyclist","status":"published"},{"crash_count":10,"involved_mode":"pedalcyclist","status":"published"},{"crash_count":126,"involved_mode":"pedestrian","status":"published"},{"involved_mode":"other_road_user","status":"suppressed_or_zero"},{"crash_count":13,"involved_mode":"unknown","status":"published"}],"state_abbreviation":"AL","state_code":"1","state_name":"Alabama"},{"cells":[{"crash_count":59,"involved_mode":"motor_vehicle_occupant","status":"published"},{"crash_count":10,"involved_mode":"motorcyclist","status":"published"},{"involved_mode":"pedalcyclist","status":"suppressed_or_zero"},{"crash_count":15,"involved_mode":"pedestrian","status":"published"},{"involved_mode":"other_road_user","status":"suppressed_or_zero"},{"involved_mode":"unknown","status":"suppressed_or_zero"}],"state_abbreviation":"AK","state_code":"2","state_name":"Alaska"},{"cells":[{"crash_count":926,"involved_mode":"motor_vehicle_occupant","status":"published"},{"crash_count":210,"involved_mode":"motorcyclist","status":"published"},{"crash_count":41,"involved_mode":"pedalcyclist","status":"published"},{"crash_count":229,"involved_mode":"pedestrian","status":"published"},{"crash_count":13,"involved_mode":"other_road_user","status":"published"},{"crash_count":71,"involved_mode":"unknown","status":"published"}],"state_abbreviation":"AZ","state_code":"4","state_name":"Arizona"},{"cells":[{"crash_count":499,"involved_mode":"motor_vehicle_occupant","status":"published"},{"crash_count":75,"involved_mode":"motorcyclist","status":"published"},{"involved_mode":"pedalcyclist","status":"suppressed_or_zero"},{"crash_count":69,"involved_mode":"pedestrian","status":"published"},{"involved_mode":"other_road_user","status":"suppressed_or_zero"},{"crash_count":13,"involved_mode":"unknown","status":"published"}],"state_abbreviation":"AR","state_code":"5","state_name":"Arkansas"},{"cells":[{"crash_count":3210,"involved_mode":"motor_vehicle_occupant","status":"published"},{"crash_count":518,"involved_mode":"motorcyclist","status":"published"},{"crash_count":164,"involved_mode":"pedalcyclist","status":"published"},{"crash_count":1089,"involved_mode":"pedestrian","status":"published"},{"crash_count":52,"involved_mode":"other_road_user","status":"published"},{"crash_count":203,"involved_mode":"unknown","status":"published"}],"state_abbreviation":"CA","state_code":"6","state_name":"California"},{"cells":[{"crash_count":570,"involved_mode":"motor_vehicle_occupant","status":"published"},{"crash_count":170,"involved_mode":"motorcyclist","status":"published"},{"crash_count":15,"involved_mode":"pedalcyclist","status":"published"},{"crash_count":112,"involved_mode":"pedestrian","status":"published"},{"involved_mode":"other_road_user","status":"suppressed_or_zero"},{"crash_count":13,"involved_mode":"unknown","status":"published"}],"state_abbreviation":"CO","state_code":"8","state_name":"Colorado"},{"cells":[{"crash_count":244,"involved_mode":"motor_vehicle_occupant","status":"published"},{"crash_count":73,"involved_mode":"motorcyclist","status":"published"},{"involved_mode":"pedalcyclist","status":"suppressed_or_zero"},{"crash_count":59,"involved_mode":"pedestrian","status":"published"},{"involved_mode":"other_road_user","status":"suppressed_or_zero"},{"crash_count":12,"involved_mode":"unknown","status":"published"}],"state_abbreviation":"CT","state_code":"9","state_name":"Connecticut"},{"cells":[{"crash_count":115,"involved_mode":"motor_vehicle_occupant","status":"published"},{"crash_count":23,"involved_mode":"motorcyclist","status":"published"},{"involved_mode":"pedalcyclist","status":"suppressed_or_zero"},{"crash_count":28,"involved_mode":"pedestrian","status":"published"},{"involved_mode":"other_road_user","status":"suppressed_or_zero"},{"involved_mode":"unknown","status":"suppressed_or_zero"}],"state_abbreviation":"DE","state_code":"10","state_name":"Delaware"},{"cells":[{"crash_count":34,"involved_mode":"motor_vehicle_occupant","status":"published"},{"involved_mode":"motorcyclist","status":"suppressed_or_zero"},{"involved_mode":"pedalcyclist","status":"suppressed_or_zero"},{"crash_count":18,"involved_mode":"pedestrian","status":"published"},{"involved_mode":"other_road_user","status":"suppressed_or_zero"},{"involved_mode":"unknown","status":"suppressed_or_zero"}],"state_abbreviation":"DC","state_code":"11","state_name":"District of Columbia"},{"cells":[{"crash_count":2667,"involved_mode":"motor_vehicle_occupant","status":"published"},{"crash_count":642,"involved_mode":"motorcyclist","status":"published"},{"crash_count":209,"involved_mode":"pedalcyclist","status":"published"},{"crash_count":666,"involved_mode":"pedestrian","status":"published"},{"crash_count":43,"involved_mode":"other_road_user","status":"published"},{"crash_count":118,"involved_mode":"unknown","status":"published"}],"state_abbreviation":"FL","state_code":"12","state_name":"Florida"},{"cells":[{"crash_count":1221,"involved_mode":"motor_vehicle_occupant","status":"published"},{"crash_count":179,"involved_mode":"motorcyclist","status":"published"},{"crash_count":25,"involved_mode":"pedalcyclist","status":"published"},{"crash_count":286,"involved_mode":"pedestrian","status":"published"},{"involved_mode":"other_road_user","status":"suppressed_or_zero"},{"crash_count":33,"involved_mode":"unknown","status":"published"}],"state_abbreviation":"GA","state_code":"13","state_name":"Georgia"},{"cells":[{"crash_count":82,"involved_mode":"motor_vehicle_occupant","status":"published"},{"crash_count":27,"involved_mode":"motorcyclist","status":"published"},{"involved_mode":"pedalcyclist","status":"suppressed_or_zero"},{"crash_count":35,"involved_mode":"pedestrian","status":"published"},{"involved_mode":"other_road_user","status":"suppressed_or_zero"},{"involved_mode":"unknown","status":"suppressed_or_zero"}],"state_abbreviation":"HI","state_code":"15","state_name":"Hawaii"},{"cells":[{"crash_count":192,"involved_mode":"motor_vehicle_occupant","status":"published"},{"crash_count":44,"involved_mode":"motorcyclist","status":"published"},{"involved_mode":"pedalcyclist","status":"suppressed_or_zero"},{"crash_count":14,"involved_mode":"pedestrian","status":"published"},{"involved_mode":"other_road_user","status":"suppressed_or_zero"},{"involved_mode":"unknown","status":"suppressed_or_zero"}],"state_abbreviation":"ID","state_code":"16","state_name":"Idaho"},{"cells":[{"crash_count":998,"involved_mode":"motor_vehicle_occupant","status":"published"},{"crash_count":148,"involved_mode":"motorcyclist","status":"published"},{"crash_count":37,"involved_mode":"pedalcyclist","status":"published"},{"crash_count":209,"involved_mode":"pedestrian","status":"published"},{"involved_mode":"other_road_user","status":"suppressed_or_zero"},{"crash_count":45,"involved_mode":"unknown","status":"published"}],"state_abbreviation":"IL","state_code":"17","state_name":"Illinois"},{"cells":[{"crash_count":735,"involved_mode":"motor_vehicle_occupant","status":"published"},{"crash_count":132,"involved_mode":"motorcyclist","status":"published"},{"crash_count":19,"involved_mode":"pedalcyclist","status":"published"},{"crash_count":104,"involved_mode":"pedestrian","status":"published"},{"involved_mode":"other_road_user","status":"suppressed_or_zero"},{"crash_count":11,"involved_mode":"unknown","status":"published"}],"state_abbreviation":"IN","state_code":"18","state_name":"Indiana"},{"cells":[{"crash_count":290,"involved_mode":"motor_vehicle_occupant","status":"published"},{"crash_count":63,"involved_mode":"motorcyclist","status":"published"},{"involved_mode":"pedalcyclist","status":"suppressed_or_zero"},{"crash_count":30,"involved_mode":"pedestrian","status":"published"},{"involved_mode":"other_road_user","status":"suppressed_or_zero"},{"involved_mode":"unknown","status":"suppressed_or_zero"}],"sta